{
  "$schema": "https://json-schema.org/draft/2020-12/schema",
  "$id": "application-route.schema.json",
  "title": "Application Route",
  "description": "The path a particular applicant uses to apply for a particular Opportunity in a particular intake. One Opportunity can have several routes — central, direct, international, special-category — with different rounds, fees and deadlines. This is why a single 'apply here' link on an institution is not good enough.",
  "type": "object",
  "required": [
    "id",
    "destination",
    "intake",
    "applicantGroup",
    "channel",
    "meta"
  ],
  "properties": {
    "id": {
      "$ref": "common.schema.json#/$defs/id"
    },
    "destination": {
      "$ref": "common.schema.json#/$defs/id"
    },
    "appliesTo": {
      "type": "array",
      "description": "Opportunity ids. Empty means it applies to every Opportunity in the destination.",
      "items": {
        "$ref": "common.schema.json#/$defs/id"
      }
    },
    "intake": {
      "$ref": "common.schema.json#/$defs/intake"
    },
    "applicantGroup": {
      "$ref": "common.schema.json#/$defs/applicantGroup"
    },
    "readerAccess": {
      "$ref": "common.schema.json#/$defs/readerAccess",
      "description": "Whether this site’s reader can take this route at all. A closed route renders once, exclusion first, with no date to act on; its rounds and milestones inherit it."
    },
    "label": {
      "type": "string"
    },
    "channel": {
      "enum": [
        "application-system",
        "direct",
        "agent",
        "consortium",
        "other"
      ]
    },
    "applicationSystem": {
      "$ref": "common.schema.json#/$defs/id"
    },
    "portalUrl": {
      "$ref": "common.schema.json#/$defs/url"
    },
    "choiceLimit": {
      "type": "integer",
      "minimum": 1
    },
    "choicesRanked": {
      "type": "boolean",
      "description": "Where true, ordering changes the outcome and the student needs telling."
    },
    "fee": {
      "$ref": "common.schema.json#/$defs/money"
    },
    "rounds": {
      "type": "array",
      "items": {
        "type": "object",
        "required": [
          "id",
          "label"
        ],
        "properties": {
          "id": {
            "$ref": "common.schema.json#/$defs/id"
          },
          "label": {
            "type": "string"
          },
          "opens": {
            "$ref": "common.schema.json#/$defs/isoDate"
          },
          "closes": {
            "$ref": "common.schema.json#/$defs/isoDate"
          },
          "decisionBy": {
            "$ref": "common.schema.json#/$defs/isoDate"
          },
          "institutions": {
            "$ref": "common.schema.json#/$defs/institutionRefs"
          },
          "consequence": {
            "$ref": "common.schema.json#/$defs/consequence"
          },
          "readerAccess": {
            "$ref": "common.schema.json#/$defs/readerAccess"
          },
          "note": {
            "type": "string"
          },
          "evidence": {
            "$ref": "common.schema.json#/$defs/evidenceRefs"
          },
          "dateState": {
            "enum": [
              "not-published",
              "no-central-deadline",
              "varies-by-institution",
              "rolling",
              "not-yet-announced",
              "withdrawn"
            ],
            "description": "Why there is no date, when there is none. A researched finding — \"there is no central deadline\", \"each institution sets its own\" — is not a missing value, and a milestone that cannot say which it is renders as \"Date not published\", which is a lie about work that was done. Mirrors the states a country profile deadline may declare; src/lib/publication-floor.mjs holds the list and src/lib/calendar.mjs reads it."
          },
          "institutionsWithoutPage": {
            "$ref": "common.schema.json#/$defs/institutionNames"
          },
          "institutionsExcept": {
            "$ref": "common.schema.json#/$defs/institutionExceptRefs"
          },
          "yearUnpublished": {
            "$ref": "common.schema.json#/$defs/yearUnpublished"
          },
          "numerusFixusOnly": {
            "$ref": "common.schema.json#/$defs/numerusFixusOnly"
          },
          "provisional": {
            "type": "boolean",
            "description": "True when the round's closing date is not confirmed for this cycle (inherited, or its source gives no year). A provisional date must never be shown as a confirmed one."
          }
        },
        "additionalProperties": false
      }
    },
    "milestones": {
      "type": "array",
      "description": "Dated events, not only deadlines. Opening, result, reply and deposit dates all matter.",
      "items": {
        "type": "object",
        "required": [
          "id",
          "type",
          "label",
          "consequence"
        ],
        "properties": {
          "id": {
            "$ref": "common.schema.json#/$defs/id"
          },
          "type": {
            "enum": [
              "open",
              "submit",
              "document",
              "signature",
              "test",
              "fee",
              "result",
              "reply",
              "deposit",
              "visa",
              "enrolment",
              "personal"
            ]
          },
          "label": {
            "type": "string"
          },
          "date": {
            "$ref": "common.schema.json#/$defs/isoDate"
          },
          "endDate": {
            "$ref": "common.schema.json#/$defs/isoDate"
          },
          "timeOfDay": {
            "type": "string",
            "pattern": "^[0-2][0-9]:[0-5][0-9]$",
            "description": "Kept because 12:00 and 23:59 are very different promises."
          },
          "timeZone": {
            "type": "string",
            "description": "As published. Never silently converted."
          },
          "consequence": {
            "$ref": "common.schema.json#/$defs/consequence"
          },
          "audience": {
            "$ref": "common.schema.json#/$defs/applicantGroup"
          },
          "readerAccess": {
            "$ref": "common.schema.json#/$defs/readerAccess"
          },
          "provisional": {
            "type": "boolean",
            "description": "True when inherited from a previous cycle. A provisional date must never be shown as a confirmed one."
          },
          "note": {
            "type": "string"
          },
          "evidence": {
            "$ref": "common.schema.json#/$defs/evidenceRefs"
          },
          "institutions": {
            "$ref": "common.schema.json#/$defs/institutionRefs"
          },
          "supersedes": {
            "type": "string",
            "pattern": "^[a-z0-9]+(-[a-z0-9]+)*/[a-z0-9]+(-[a-z0-9]+)*$",
            "description": "\"<routeId>/<milestoneId>\" of a general date this one replaces wherever this one is shown. An institution's own date for a step the route also dates in general (TU Delft's 1 April beside the national 1 May, SDU's 3 August beside the earliest-known reply date): on that institution's pages the general date is left out, because two dates for one step leave a student to guess which binds. src/lib/school-dates.mjs reads it; the calendar keeps both."
          },
          "ibCalendar": {
            "type": "string",
            "pattern": "^[0-9]{4}-[0-9]{2}/[a-z0-9]+(-[a-z0-9]+)*$",
            "description": "\"<session>/<event>\" in data/ib-calendar.json, e.g. \"2027-05/results-day\". Present when this milestone's date is the IB's rather than this Destination's. IB results day was one fact written into 41 files, twenty-two of them with the identical label, and it had already drifted; scripts/test-ib-calendar.mjs refuses a milestone that states an IB date without this pointer, and refuses a date that disagrees with the record it points at."
          },
          "dateState": {
            "enum": [
              "not-published",
              "no-central-deadline",
              "varies-by-institution",
              "rolling",
              "not-yet-announced",
              "withdrawn"
            ],
            "description": "Why there is no date, when there is none. A researched finding — \"there is no central deadline\", \"each institution sets its own\" — is not a missing value, and a milestone that cannot say which it is renders as \"Date not published\", which is a lie about work that was done. Mirrors the states a country profile deadline may declare; src/lib/publication-floor.mjs holds the list and src/lib/calendar.mjs reads it."
          },
          "institutionsWithoutPage": {
            "$ref": "common.schema.json#/$defs/institutionNames"
          },
          "institutionsExcept": {
            "$ref": "common.schema.json#/$defs/institutionExceptRefs"
          },
          "yearUnpublished": {
            "$ref": "common.schema.json#/$defs/yearUnpublished"
          },
          "numerusFixusOnly": {
            "$ref": "common.schema.json#/$defs/numerusFixusOnly"
          }
        },
        "additionalProperties": false
      }
    },
    "submissionItems": {
      "type": "array",
      "items": {
        "type": "object",
        "required": [
          "id",
          "label",
          "itemType"
        ],
        "properties": {
          "id": {
            "$ref": "common.schema.json#/$defs/id"
          },
          "label": {
            "type": "string"
          },
          "itemType": {
            "enum": [
              "document",
              "result",
              "payment",
              "choice",
              "action",
              "signature",
              "biometrics"
            ]
          },
          "responsibleParty": {
            "enum": [
              "student",
              "school",
              "institution",
              "authority",
              "third-party"
            ]
          },
          "destinationOfItem": {
            "type": "string",
            "description": "Where it actually has to arrive — often not the portal."
          },
          "format": {
            "type": "string"
          },
          "dependsOn": {
            "type": "array",
            "items": {
              "$ref": "common.schema.json#/$defs/id"
            }
          },
          "dueMilestone": {
            "$ref": "common.schema.json#/$defs/id"
          },
          "note": {
            "type": "string"
          },
          "evidence": {
            "$ref": "common.schema.json#/$defs/evidenceRefs"
          }
        },
        "additionalProperties": false
      }
    },
    "supplementarySteps": {
      "type": "array",
      "items": {
        "type": "string"
      }
    },
    "evidence": {
      "$ref": "common.schema.json#/$defs/evidenceRefs"
    },
    "meta": {
      "$ref": "common.schema.json#/$defs/recordMeta"
    },
    "jurisdiction": {
      "description": "The Application Jurisdiction(s) this route serves, where the Destination declares several. One id, or an array where a route genuinely serves more than one — Canada’s apply-direct route covers Quebec, Alberta and Nova Scotia, and forcing that to be unscoped made it the destination-wide fallback, which is exactly what the route floor check exists to catch. A route with no jurisdiction and no appliesTo covers the whole Destination: the right shape for a centralised system and the wrong one for a federal one.",
      "oneOf": [
        {
          "$ref": "common.schema.json#/$defs/id"
        },
        {
          "type": "array",
          "minItems": 1,
          "items": {
            "$ref": "common.schema.json#/$defs/id"
          }
        }
      ]
    }
  },
  "additionalProperties": false
}
