{
  "id": "nl-maastricht-selection-2027",
  "destination": "nl",
  "intake": "2027-autumn",
  "applicantGroup": "any",
  "label": "Applying to Maastricht University for autumn 2027",
  "channel": "application-system",
  "applicationSystem": "nl-studielink",
  "portalUrl": "https://www.studielink.nl/",
  "appliesTo": [
    "nl-maastricht-international-business-2027-autumn",
    "nl-maastricht-university-college-maastricht-2027-autumn",
    "nl-maastricht-data-science-and-artificial-intelligence-2027-autumn"
  ],
  "milestones": [
    {
      "id": "ms-open",
      "type": "open",
      "label": "Maastricht applications open in Studielink",
      "date": "2026-10-01",
      "consequence": "indicative",
      "note": "Applications for 2027-2028 open on 1 October. University College Maastricht reviews them on a rolling basis from then until its deadline.",
      "evidence": [
        "ev-studielink-2027-2028-dates",
        "ev-um-nl-ucm"
      ]
    },
    {
      "id": "ms-ucm-noneu",
      "type": "submit",
      "label": "University College Maastricht closes for non-EU/EEA applicants",
      "date": "2027-02-01",
      "timeOfDay": "23:59",
      "timeZone": "CET",
      "consequence": "hard",
      "audience": "non-eu",
      "note": "Studielink application and every admission task in Maastricht's own MyApplication portal, both by this date.",
      "evidence": [
        "ev-um-nl-ucm"
      ]
    },
    {
      "id": "ms-ib-fixus",
      "type": "submit",
      "label": "International Business numerus fixus application closes",
      "date": "2027-01-15",
      "timeOfDay": "23:59",
      "timeZone": "CET",
      "consequence": "hard",
      "provisional": true,
      "note": "The national numerus fixus date. Maastricht's published table gives 15 January 2026 for the 2026-2027 round; the 2027 date is inherited from the national rule and is provisional until Maastricht republishes. Studielink and all MyApplication admission tasks must both be complete.",
      "evidence": [
        "ev-um-nl-international-business"
      ]
    },
    {
      "id": "ms-ucm-eu",
      "type": "submit",
      "label": "University College Maastricht closes for EU/EEA and Swiss applicants",
      "date": "2027-04-01",
      "timeOfDay": "23:59",
      "timeZone": "CET",
      "consequence": "hard",
      "audience": "eu-eea-ch",
      "note": "Neither 15 January nor 1 May. UCM is selective without being numerus fixus and sets its own date.",
      "evidence": [
        "ev-um-nl-ucm"
      ]
    },
    {
      "id": "ms-dsai-noneu",
      "type": "submit",
      "label": "Data Science and AI closes for non-EU/EEA applicants",
      "date": "2027-04-01",
      "timeOfDay": "23:59",
      "timeZone": "CET",
      "consequence": "hard",
      "audience": "non-eu",
      "evidence": [
        "ev-um-nl-dsai"
      ]
    },
    {
      "id": "ms-dsai-eu",
      "type": "submit",
      "label": "Data Science and AI closes for EU/EEA and Swiss applicants",
      "date": "2027-05-01",
      "timeOfDay": "23:59",
      "timeZone": "CET",
      "consequence": "hard",
      "audience": "eu-eea-ch",
      "note": "Maastricht’s own deadline for the whole application, Studielink and MyApplication tasks included. The programme is not capped, and the date matches the national 1 May.",
      "evidence": [
        "ev-um-nl-dsai"
      ]
    },
    {
      "id": "ms-maths-syllabus-noneu",
      "type": "document",
      "label": "Data Science and AI maths syllabus due, non-EU/EEA (only if Maastricht asks)",
      "date": "2027-05-01",
      "timeOfDay": "23:59",
      "timeZone": "CET",
      "consequence": "hard",
      "audience": "non-eu",
      "note": "Only if Maastricht tells you your mathematics falls short: a syllabus for its mathematics sufficiency check. EU/EEA and Swiss applicants: 1 June.",
      "evidence": [
        "ev-um-nl-dsai"
      ]
    },
    {
      "id": "ms-ib-ranking",
      "type": "result",
      "label": "International Business ranking number published",
      "date": "2027-04-15",
      "timeOfDay": "23:59",
      "timeZone": "CET",
      "consequence": "indicative",
      "provisional": true,
      "note": "Also the date on which an applicant is told they failed the International Classroom requirement and are not in the ranking at all.",
      "evidence": [
        "ev-um-nl-international-business"
      ]
    },
    {
      "id": "ms-maths-syllabus",
      "type": "document",
      "label": "Data Science and AI maths syllabus due, EU/EEA and Swiss (only if Maastricht asks)",
      "date": "2027-06-01",
      "timeOfDay": "23:59",
      "timeZone": "CET",
      "consequence": "hard",
      "note": "Only if Maastricht tells you your mathematics falls short: a syllabus for its mathematics sufficiency check. A shortfall is a process rather than a refusal, and it must be cleared before the first year starts. Non-EU/EEA applicants: 1 May.",
      "evidence": [
        "ev-um-nl-dsai"
      ],
      "audience": "eu-eea-ch"
    },
    {
      "id": "ms-enrolment",
      "type": "enrolment",
      "label": "All enrolment tasks complete",
      "date": "2027-08-31",
      "timeOfDay": "23:59",
      "timeZone": "CET",
      "consequence": "hard",
      "note": "Including the certified copy of your diploma — which is why IB results arriving in early July is workable here: the diploma is an enrolment task, not an admission task.",
      "evidence": [
        "ev-um-nl-ucm",
        "ev-um-nl-dsai"
      ]
    }
  ],
  "evidence": [
    "ev-um-nl-ucm",
    "ev-um-nl-dsai",
    "ev-um-nl-international-business"
  ],
  "meta": {
    "schemaVersion": "1.0",
    "dataAsOf": "2026-09-23",
    "notes": [
      "Maastricht runs three different calendars at once and this route holds all three, because they are three properties of one university rather than three routes a student chooses between. Which milestones bind depends on the Opportunity and, for two of them, on nationality.",
      "The split between admission tasks and enrolment tasks is the answer to the July problem at this university: the certified diploma is due on 31 August, after IB results. Whether the other Dutch institutions in this catalogue work the same way was not established."
    ]
  }
}
