{
  "id": "mt-direct-2027",
  "destination": "mt",
  "intake": "2027-autumn",
  "applicantGroup": "any",
  "label": "Applying directly to a Maltese institution",
  "channel": "direct",
  "portalUrl": "https://www.um.edu.mt/courses",
  "choicesRanked": false,
  "milestones": [
    {
      "id": "ms-um-main",
      "type": "submit",
      "label": "University of Malta: main application deadline, October 2027 intake",
      "dateState": "not-yet-announced",
      "consequence": "hard",
      "note": "Not published on 24 September 2026. Applications open from the November before. In 2026 the main deadline was 22 July at 14:00; medicine closed on 16 March for IB applicants. At the University of Malta the IB counts as a local qualification: choose \"Local Qualifications\" when you apply.",
      "evidence": ["ev-mt-um-dates-2027", "ev-mt-um-local-qualification"]
    },
    {
      "id": "ms-others",
      "type": "submit",
      "label": "MCAST, ITS and the private institutions",
      "dateState": "varies-by-institution",
      "consequence": "indicative",
      "note": "Each applies through its own website and sets its own date.",
      "evidence": ["ev-mt-mcast-international"]
    },
    {
      "id": "ms-ib",
      "type": "result",
      "label": "IB results released",
      "date": "2027-07-06",
      "consequence": "indicative",
      "evidence": ["ev-ib-results-day-2027-05"],
      "ibCalendar": "2027-05/results-day",
      "provisional": true
    },
    {
      "id": "ms-um-start",
      "type": "enrolment",
      "label": "University of Malta: first semester begins for first-year students",
      "date": "2027-10-04",
      "consequence": "indicative",
      "evidence": ["ev-mt-um-semester-2027"]
    }
  ],
  "evidence": ["ev-mt-um-dates-2027"],
  "meta": { "schemaVersion": "1.0", "dataAsOf": "2026-09-24", "reviewBy": "2026-11-30" }
}
