{
  "id": "be-fl-direct-2027",
  "destination": "be",
  "jurisdiction": "be-fl",
  "intake": "2027-autumn",
  "applicantGroup": "any",
  "label": "Applying directly to a Flemish institution for autumn 2027",
  "channel": "direct",
  "portalUrl": "https://www.studyinflanders.be/practical-information/how-to-apply",
  "milestones": [
    {
      "id": "ms-be-fl-open",
      "type": "open",
      "label": "Applications open at most Flemish institutions",
      "dateState": "varies-by-institution",
      "consequence": "indicative",
      "note": "Usually around November-December. Each institution sets its own opening and closing dates.",
      "evidence": [
        "ev-be-fl-how-to-apply"
      ]
    },
    {
      "id": "ms-be-fl-exam-register",
      "type": "test",
      "label": "Register for the medicine, dentistry or veterinary entrance exam",
      "date": "2027-03-01",
      "endDate": "2027-05-17",
      "consequence": "hard",
      "note": "No late registration. One registration and fee per exam.",
      "evidence": [
        "ev-be-fl-entrance-exam-2027"
      ]
    },
    {
      "id": "ms-be-fl-exam-arts",
      "type": "test",
      "label": "Entrance exam - medicine (arts)",
      "date": "2027-07-02",
      "consequence": "hard",
      "note": "Dentistry is on 3 July, veterinary medicine on 4 July.",
      "evidence": [
        "ev-be-fl-entrance-exam-2027"
      ]
    },
    {
      "id": "ms-be-fl-ib-results",
      "type": "result",
      "label": "IB results released",
      "date": "2027-07-06",
      "consequence": "indicative",
      "provisional": true,
      "evidence": [
        "ev-ib-results-day-2027-05"
      ],
      "ibCalendar": "2027-05/results-day"
    }
  ],
  "submissionItems": [
    {
      "id": "si-be-fl-english",
      "label": "Proof of English at B2 for an English-taught programme",
      "itemType": "document",
      "responsibleParty": "student",
      "destinationOfItem": "The institution",
      "note": "Check whether your IB English counts as proof. Each institution decides.",
      "evidence": [
        "ev-be-fl-admission"
      ]
    }
  ],
  "evidence": [
    "ev-be-fl-how-to-apply",
    "ev-be-fl-entrance-exam-2027",
    "ev-be-fl-admission"
  ],
  "meta": {
    "schemaVersion": "1.0",
    "dataAsOf": "2026-09-23",
    "reviewBy": "2026-12-15",
    "notes": [
      "No central system in Flanders. Closing dates are per institution and often per programme; KU Leuven's application-windows tool offered no 2027-2028 year when checked.",
      "Covers the Dutch-language institutions in Brussels (VUB, Odisee) and Vesalius College, which is part of VUB's Brussels School of Governance."
    ]
  }
}
